{
  "$schema": "https://json-schema.org/draft/2020-12/schema",
  "$id": "https://github.com/edgytoast/avp-ports-index/schema/feed-v1.schema.json",
  "title": "AVP Ports Index feed, version 1",
  "description": "Generated by CI. Key on id; poll at most hourly. Additive optional fields bump the minor version; anything else creates feed/v2/.",
  "type": "object",
  "additionalProperties": false,
  "required": ["$schema", "schema_version", "identifier", "generated_at", "publisher", "license", "entries", "unavailable", "tombstones"],
  "properties": {
    "$schema": {"type": "string"},
    "schema_version": {"type": "string", "pattern": "^1\\.\\d+\\.\\d+$"},
    "identifier": {"const": "com.trevorbilt.avp-ports-index"},
    "generated_at": {"$ref": "#/$defs/iso"},
    "publisher": {
      "type": "object",
      "additionalProperties": false,
      "required": ["name", "curator", "github", "url", "contact"],
      "properties": {
        "name": {"type": "string"},
        "curator": {"type": "string"},
        "github": {"type": "string"},
        "url": {"type": "string"},
        "contact": {"type": "string"}
      }
    },
    "license": {"const": "CC0-1.0"},
    "entries": {"type": "array", "items": {"$ref": "#/$defs/entry"}},
    "unavailable": {"type": "array", "items": {"$ref": "#/$defs/unavailable"}},
    "tombstones": {
      "type": "array",
      "items": {
        "type": "object",
        "additionalProperties": false,
        "required": ["id", "removed_at"],
        "properties": {
          "id": {"type": "string"},
          "removed_at": {"$ref": "#/$defs/iso"}
        }
      }
    }
  },
  "$defs": {
    "iso": {"type": "string", "pattern": "^\\d{4}-\\d{2}-\\d{2}T\\d{2}:\\d{2}:\\d{2}Z$"},
    "iso_or_null": {"anyOf": [{"$ref": "#/$defs/iso"}, {"type": "null"}]},
    "str_or_null": {"type": ["string", "null"]},
    "credit": {
      "type": "object",
      "additionalProperties": false,
      "required": ["name", "role", "url"],
      "properties": {
        "name": {"type": "string"},
        "role": {"type": "string"},
        "url": {"$ref": "#/$defs/str_or_null"}
      }
    },
    "entry": {
      "type": "object",
      "additionalProperties": false,
      "required": ["id", "name", "game", "repo_url", "source_ref", "source_url", "install_doc_url", "developer", "credits", "upstream",
                   "self_reported_status", "status_notes", "owner_verified", "trust_tier", "curator_own", "health",
                   "scanned_commit", "scanned_at", "scan_kind", "commits_since_scan", "scan_state", "archived",
                   "last_commit_date", "license", "visionos_min", "input", "experiences", "install", "tags", "description", "page_url",
                   "media"],
      "properties": {
        "id": {"type": "string"},
        "name": {"type": "string"},
        "game": {
          "type": "object",
          "additionalProperties": false,
          "required": ["title", "original_platform", "original_release_year"],
          "properties": {
            "title": {"type": "string"},
            "original_platform": {"$ref": "#/$defs/str_or_null"},
            "original_release_year": {"type": ["integer", "null"]}
          }
        },
        "repo_url": {"type": "string"},
        "source_ref": {"type": ["string", "null"], "description": "The branch the index follows, when it isn't the repo's default branch (added in 1.1.0)."},
        "source_url": {"type": "string"},
        "install_doc_url": {"type": "string", "description": "The install guide at the scanned commit, with its #anchor when it names one."},
        "install_guide": {"type": "string", "pattern": "^[A-Za-z0-9_./-]+(#[a-z0-9_-]+)?$", "description": "The install guide's path in the repo, with #anchor when it names a section: AVP-INSTALL.md unless the entry sets install_guide, such as README.md#install (added in 1.5.0)."},
        "developer": {
          "type": "object",
          "additionalProperties": false,
          "required": ["name", "github", "url", "github_verified"],
          "properties": {
            "name": {"$ref": "#/$defs/str_or_null"},
            "github": {"type": "string"},
            "url": {"$ref": "#/$defs/str_or_null"},
            "github_verified": {"type": "boolean"}
          }
        },
        "credits": {"type": "array", "items": {"$ref": "#/$defs/credit"}},
        "upstream": {"type": "array", "items": {"type": "string"}},
        "self_reported_status": {"enum": ["developer-verified", "working", "partially-working", "not-working"]},
        "status_notes": {"$ref": "#/$defs/str_or_null"},
        "owner_verified": {
          "type": "object",
          "additionalProperties": false,
          "required": ["verified", "verified_on", "verified_commit"],
          "properties": {
            "verified": {"type": "boolean"},
            "verified_on": {"$ref": "#/$defs/str_or_null"},
            "verified_commit": {"$ref": "#/$defs/str_or_null"}
          }
        },
        "trust_tier": {"enum": ["owner-verified", "developer-verified", "working", "partially-working", "not-working"]},
        "curator_own": {"type": "boolean"},
        "health": {
          "type": "object",
          "additionalProperties": false,
          "required": ["status", "failing_since"],
          "properties": {
            "status": {"enum": ["ok", "issues"]},
            "failing_since": {"$ref": "#/$defs/iso_or_null"}
          }
        },
        "scanned_commit": {"type": "string", "pattern": "^[0-9a-f]{40}$"},
        "scanned_at": {"$ref": "#/$defs/iso"},
        "scan_kind": {"enum": ["automated", "curator-reviewed"]},
        "commits_since_scan": {"type": ["integer", "null"]},
        "scan_state": {"enum": ["current", "behind", "unknown"]},
        "archived": {"type": "boolean"},
        "last_commit_date": {"$ref": "#/$defs/iso_or_null"},
        "license": {
          "type": "object",
          "additionalProperties": false,
          "required": ["spdx", "kind"],
          "properties": {
            "spdx": {"$ref": "#/$defs/str_or_null"},
            "kind": {"enum": ["open-source", "custom", "none"]}
          }
        },
        "visionos_min": {"$ref": "#/$defs/str_or_null"},
        "input": {"type": "array", "items": {"type": "string"}},
        "experiences": {"type": "array", "items": {"enum": ["2d", "3d-immersive", "3d-shared-space", "3d-tabletop", "6dof-immersive", "6dof-progressive"]}, "description": "How the port plays (added in 1.2.0; 3d-tabletop added in 1.3.0)."},
        "install": {"type": "array", "items": {"enum": ["build", "sideload"]}, "description": "build (from source) and/or sideload (a prebuilt app the index didn't review); added in 1.2.0."},
        "tags": {"type": "array", "items": {"type": "string"}},
        "description": {"$ref": "#/$defs/str_or_null"},
        "page_url": {"type": "string"},
        "media": {"anyOf": [{"$ref": "#/$defs/media"}, {"type": "null"}], "description": "Screenshots and the app icon, as links pinned to the scanned commit with each file's size and SHA-256; null when there are none (added in 1.4.0)."}
      }
    },
    "image": {
      "type": "object",
      "additionalProperties": false,
      "required": ["url", "format", "width", "height", "bytes", "sha256"],
      "properties": {
        "url": {"type": "string", "pattern": "^https://(github\\.com|raw\\.githubusercontent\\.com|user-images\\.githubusercontent\\.com)/"},
        "alt": {"$ref": "#/$defs/str_or_null"},
        "layer": {"type": "string"},
        "format": {"enum": ["png", "jpeg", "gif", "webp"]},
        "width": {"type": "integer", "minimum": 1},
        "height": {"type": "integer", "minimum": 1},
        "bytes": {"type": "integer", "minimum": 1},
        "sha256": {"type": "string", "pattern": "^[0-9a-f]{64}$"}
      }
    },
    "media": {
      "type": "object",
      "additionalProperties": false,
      "required": ["commit", "source", "icon", "screenshots"],
      "properties": {
        "commit": {"type": "string", "pattern": "^[0-9a-f]{40}$"},
        "source": {"enum": ["readme", "entry"]},
        "icon": {"anyOf": [
          {"type": "null"},
          {"type": "object", "additionalProperties": false, "required": ["kind", "url", "format", "width", "height", "bytes", "sha256"],
           "properties": {"kind": {"const": "flat"}, "url": {"$ref": "#/$defs/image/properties/url"}, "format": {"$ref": "#/$defs/image/properties/format"},
                          "width": {"type": "integer"}, "height": {"type": "integer"}, "bytes": {"type": "integer"}, "sha256": {"$ref": "#/$defs/image/properties/sha256"}}},
          {"type": "object", "additionalProperties": false, "required": ["kind", "layers"],
           "properties": {"kind": {"const": "layered"}, "layers": {"type": "array", "minItems": 2, "maxItems": 3, "items": {"$ref": "#/$defs/image"}}}}
        ]},
        "screenshots": {"type": "array", "maxItems": 3, "items": {"$ref": "#/$defs/image"}}
      }
    },
    "unavailable": {
      "type": "object",
      "additionalProperties": false,
      "required": ["id", "name", "game", "developer", "credits", "listed_at", "unavailable_since", "last_scanned_commit"],
      "properties": {
        "id": {"type": "string"},
        "name": {"type": "string"},
        "game": {
          "type": "object",
          "additionalProperties": false,
          "required": ["title"],
          "properties": {"title": {"type": "string"}}
        },
        "developer": {
          "type": "object",
          "additionalProperties": false,
          "required": ["name", "github"],
          "properties": {
            "name": {"$ref": "#/$defs/str_or_null"},
            "github": {"type": "string"}
          }
        },
        "credits": {"type": "array", "items": {"$ref": "#/$defs/credit"}},
        "listed_at": {"$ref": "#/$defs/iso_or_null"},
        "unavailable_since": {"$ref": "#/$defs/iso"},
        "last_scanned_commit": {"type": ["string", "null"]}
      }
    }
  }
}
